hedId	rdfs:label	Level	omn:SubClassOf	Attributes	dc:description	omn:EquivalentTo
	High-posterior-dominant-rhythm-amplitude-range-#	4	High-posterior-dominant-rhythm-amplitude-range	takesValue, valueClass=textClass	Free text.	"High-posterior-dominant-rhythm-amplitude-range and (takesValue value true) and (valueClass value ""textClass"")"
	Posterior-dominant-rhythm-frequency-asymmetry	2	Posterior-dominant-rhythm-property	suggestedTag=Symmetrical	When symmetrical could be labeled with suggested tag.	"Posterior-dominant-rhythm-property and (suggestedTag value ""Symmetrical"")"
	Posterior-dominant-rhythm-frequency-asymmetry-lower-left	3	Posterior-dominant-rhythm-frequency-asymmetry		Hz lower on the left side.	
	Posterior-dominant-rhythm-frequency-asymmetry-lower-left-#	4	Posterior-dominant-rhythm-frequency-asymmetry-lower-left	takesValue, valueClass=textClass	Free text.	"Posterior-dominant-rhythm-frequency-asymmetry-lower-left and (takesValue value true) and (valueClass value ""textClass"")"
	Posterior-dominant-rhythm-frequency-asymmetry-lower-right	3	Posterior-dominant-rhythm-frequency-asymmetry		Hz lower on the right side.	
	Posterior-dominant-rhythm-frequency-asymmetry-lower-right-#	4	Posterior-dominant-rhythm-frequency-asymmetry-lower-right	takesValue, valueClass=textClass	Free text.	"Posterior-dominant-rhythm-frequency-asymmetry-lower-right and (takesValue value true) and (valueClass value ""textClass"")"
	Posterior-dominant-rhythm-eye-opening-reactivity	2	Posterior-dominant-rhythm-property	suggestedTag=Property-not-possible-to-determine	Change (disappearance or measurable decrease in amplitude) of a posterior dominant rhythm following eye-opening. Eye closure has the opposite effect.	"Posterior-dominant-rhythm-property and (suggestedTag value ""Property-not-possible-to-determine"")"
	Posterior-dominant-rhythm-eye-opening-reactivity-reduced-left	3	Posterior-dominant-rhythm-eye-opening-reactivity		Reduced left side reactivity.	
	Posterior-dominant-rhythm-eye-opening-reactivity-reduced-left-#	4	Posterior-dominant-rhythm-eye-opening-reactivity-reduced-left	takesValue, valueClass=textClass	Free text.	"Posterior-dominant-rhythm-eye-opening-reactivity-reduced-left and (takesValue value true) and (valueClass value ""textClass"")"
	Posterior-dominant-rhythm-eye-opening-reactivity-reduced-right	3	Posterior-dominant-rhythm-eye-opening-reactivity		Reduced right side reactivity.	
	Posterior-dominant-rhythm-eye-opening-reactivity-reduced-right-#	4	Posterior-dominant-rhythm-eye-opening-reactivity-reduced-right	takesValue, valueClass=textClass	free text	"Posterior-dominant-rhythm-eye-opening-reactivity-reduced-right and (takesValue value true) and (valueClass value ""textClass"")"
	Posterior-dominant-rhythm-eye-opening-reactivity-reduced-both	3	Posterior-dominant-rhythm-eye-opening-reactivity		Reduced reactivity on both sides.	
	Posterior-dominant-rhythm-eye-opening-reactivity-reduced-both-#	4	Posterior-dominant-rhythm-eye-opening-reactivity-reduced-both	takesValue, valueClass=textClass	Free text.	"Posterior-dominant-rhythm-eye-opening-reactivity-reduced-both and (takesValue value true) and (valueClass value ""textClass"")"
	Posterior-dominant-rhythm-organization	2	Posterior-dominant-rhythm-property	suggestedTag=Normal	When normal could be labeled with suggested tag.	"Posterior-dominant-rhythm-property and (suggestedTag value ""Normal"")"
	Posterior-dominant-rhythm-organization-poorly-organized	3	Posterior-dominant-rhythm-organization		Poorly organized.	
	Posterior-dominant-rhythm-organization-poorly-organized-#	4	Posterior-dominant-rhythm-organization-poorly-organized	takesValue, valueClass=textClass	Free text.	"Posterior-dominant-rhythm-organization-poorly-organized and (takesValue value true) and (valueClass value ""textClass"")"
	Posterior-dominant-rhythm-organization-disorganized	3	Posterior-dominant-rhythm-organization		Disorganized.	
	Posterior-dominant-rhythm-organization-disorganized-#	4	Posterior-dominant-rhythm-organization-disorganized	takesValue, valueClass=textClass	Free text.	"Posterior-dominant-rhythm-organization-disorganized and (takesValue value true) and (valueClass value ""textClass"")"
	Posterior-dominant-rhythm-organization-markedly-disorganized	3	Posterior-dominant-rhythm-organization		Markedly disorganized.	
	Posterior-dominant-rhythm-organization-markedly-disorganized-#	4	Posterior-dominant-rhythm-organization-markedly-disorganized	takesValue, valueClass=textClass	Free text.	"Posterior-dominant-rhythm-organization-markedly-disorganized and (takesValue value true) and (valueClass value ""textClass"")"
	Posterior-dominant-rhythm-caveat	2	Posterior-dominant-rhythm-property		Caveat to the annotation of PDR.	
	No-posterior-dominant-rhythm-caveat	3	Posterior-dominant-rhythm-caveat			
	No-posterior-dominant-rhythm-caveat-#	4	No-posterior-dominant-rhythm-caveat	takesValue, valueClass=textClass	Free text.	"No-posterior-dominant-rhythm-caveat and (takesValue value true) and (valueClass value ""textClass"")"
	Posterior-dominant-rhythm-caveat-only-open-eyes-during-the-recording	3	Posterior-dominant-rhythm-caveat			
	Posterior-dominant-rhythm-caveat-only-open-eyes-during-the-recording-#	4	Posterior-dominant-rhythm-caveat-only-open-eyes-during-the-recording	takesValue, valueClass=textClass	Free text.	"Posterior-dominant-rhythm-caveat-only-open-eyes-during-the-recording and (takesValue value true) and (valueClass value ""textClass"")"
	Posterior-dominant-rhythm-caveat-sleep-deprived-caveat	3	Posterior-dominant-rhythm-caveat			
	Posterior-dominant-rhythm-caveat-sleep-deprived-caveat-#	4	Posterior-dominant-rhythm-caveat-sleep-deprived-caveat	takesValue, valueClass=textClass	Free text.	"Posterior-dominant-rhythm-caveat-sleep-deprived-caveat and (takesValue value true) and (valueClass value ""textClass"")"
	Posterior-dominant-rhythm-caveat-drowsy	3	Posterior-dominant-rhythm-caveat			
	Posterior-dominant-rhythm-caveat-drowsy-#	4	Posterior-dominant-rhythm-caveat-drowsy	takesValue, valueClass=textClass	Free text.	"Posterior-dominant-rhythm-caveat-drowsy and (takesValue value true) and (valueClass value ""textClass"")"
	Posterior-dominant-rhythm-caveat-only-following-hyperventilation	3	Posterior-dominant-rhythm-caveat			
	Absence-of-posterior-dominant-rhythm	2	Posterior-dominant-rhythm-property		Reason for absence of PDR.	
	Absence-of-posterior-dominant-rhythm-artifacts	3	Absence-of-posterior-dominant-rhythm			
	Absence-of-posterior-dominant-rhythm-artifacts-#	4	Absence-of-posterior-dominant-rhythm-artifacts	takesValue, valueClass=textClass	Free text.	"Absence-of-posterior-dominant-rhythm-artifacts and (takesValue value true) and (valueClass value ""textClass"")"
	Absence-of-posterior-dominant-rhythm-extreme-low-voltage	3	Absence-of-posterior-dominant-rhythm			
	Absence-of-posterior-dominant-rhythm-extreme-low-voltage-#	4	Absence-of-posterior-dominant-rhythm-extreme-low-voltage	takesValue, valueClass=textClass	Free text.	"Absence-of-posterior-dominant-rhythm-extreme-low-voltage and (takesValue value true) and (valueClass value ""textClass"")"
	Absence-of-posterior-dominant-rhythm-eye-closure-could-not-be-achieved	3	Absence-of-posterior-dominant-rhythm			
	Absence-of-posterior-dominant-rhythm-eye-closure-could-not-be-achieved-#	4	Absence-of-posterior-dominant-rhythm-eye-closure-could-not-be-achieved	takesValue, valueClass=textClass	Free text.	"Absence-of-posterior-dominant-rhythm-eye-closure-could-not-be-achieved and (takesValue value true) and (valueClass value ""textClass"")"
	Absence-of-posterior-dominant-rhythm-lack-of-awake-period	3	Absence-of-posterior-dominant-rhythm			
	Absence-of-posterior-dominant-rhythm-lack-of-awake-period-#	4	Absence-of-posterior-dominant-rhythm-lack-of-awake-period	takesValue, valueClass=textClass	Free text.	"Absence-of-posterior-dominant-rhythm-lack-of-awake-period and (takesValue value true) and (valueClass value ""textClass"")"
	Absence-of-posterior-dominant-rhythm-lack-of-compliance	3	Absence-of-posterior-dominant-rhythm			
	Absence-of-posterior-dominant-rhythm-lack-of-compliance-#	4	Absence-of-posterior-dominant-rhythm-lack-of-compliance	takesValue, valueClass=textClass	Free text.	"Absence-of-posterior-dominant-rhythm-lack-of-compliance and (takesValue value true) and (valueClass value ""textClass"")"
	Absence-of-posterior-dominant-rhythm-other-causes	3	Absence-of-posterior-dominant-rhythm	requireChild		Absence-of-posterior-dominant-rhythm and (requireChild value true)
	Absence-of-posterior-dominant-rhythm-other-causes-#	4	Absence-of-posterior-dominant-rhythm-other-causes	takesValue, valueClass=textClass	Free text.	"Absence-of-posterior-dominant-rhythm-other-causes and (takesValue value true) and (valueClass value ""textClass"")"
	Episode-property	1	Finding-property		Episode property pertains to the set of characteristics that collectively depict different aspects of an episode, encompassing its manifestations and phases.	
	Seizure-classification	2	Episode-property		Seizure classification refers to the grouping of seizures based on their clinical features, EEG patterns, and other characteristics. Epileptic seizures are named using the current ILAE seizure classification (Fisher et al., 2017, Beniczky et al., 2017).	
	Motor-seizure	3	Seizure-classification		Involves musculature in any form. The motor event could consist of an increase (positive) or decrease (negative) in muscle contraction to produce a movement. Definition from ILAE 2017 Classification of Seizure Types Expanded Version	
	Myoclonic-motor-seizure	4	Motor-seizure		Sudden, brief ( lower than 100 msec) involuntary single or multiple contraction(s) of muscles(s) or muscle groups of variable topography (axial, proximal limb, distal). Myoclonus is less regularly repetitive and less sustained than is clonus. Definition from ILAE 2017 Classification of Seizure Types Expanded Version	
	Negative-myoclonic-motor-seizure	4	Motor-seizure			
	Clonic-motor-seizure	4	Motor-seizure		Jerking, either symmetric or asymmetric, that is regularly repetitive and involves the same muscle groups. Definition from ILAE 2017 Classification of Seizure Types Expanded Version	
	Tonic-motor-seizure	4	Motor-seizure		A sustained increase in muscle contraction lasting a few seconds to minutes. Definition from ILAE 2017 Classification of Seizure Types Expanded Version	
	Atonic-motor-seizure	4	Motor-seizure		Sudden loss or diminution of muscle tone without apparent preceding myoclonic or tonic event lasting  about 1 to 2 s, involving head, trunk, jaw, or limb musculature. Definition from ILAE 2017 Classification of Seizure Types Expanded Version	
	Myoclonic-atonic-motor-seizure	4	Motor-seizure		A generalized seizure type with a myoclonic jerk leading to an atonic motor component. This type was previously called myoclonic astatic. Definition from ILAE 2017 Classification of Seizure Types Expanded Version	
	Myoclonic-tonic-clonic-motor-seizure	4	Motor-seizure		One or a few jerks of limbs bilaterally, followed by a tonic clonic seizure. The initial jerks can be considered to be either a brief period of clonus or myoclonus. Seizures with this characteristic are common in juvenile myoclonic epilepsy. Definition from ILAE 2017 Classification of Seizure Types Expanded Version	
	Tonic-clonic-motor-seizure	4	Motor-seizure		A sequence consisting of a tonic followed by a clonic phase. Definition from ILAE 2017 Classification of Seizure Types Expanded Version	
	Automatism-motor-seizure	4	Motor-seizure		A more or less coordinated motor activity usually occurring when cognition is impaired and for which the subject is usually (but not always) amnesic afterward. This often resembles a voluntary movement and may consist of an inappropriate continuation of preictal motor activity. Definition from ILAE 2017 Classification of Seizure Types Expanded Version	
	Hyperkinetic-motor-seizure	4	Motor-seizure			
	Epileptic-spasm-episode	4	Motor-seizure		A sudden flexion, extension, or mixed extension flexion of predominantly proximal and truncal muscles that is usually more sustained than a myoclonic movement but not as sustained as a tonic seizure. Limited forms may occur: Grimacing, head nodding, or subtle eye movements. Epileptic spasms frequently occur in clusters. Infantile spasms are the best known form, but spasms can occur at all ages. Definition from ILAE 2017 Classification of Seizure Types Expanded Version	
	Motor-onset-seizure	3	Seizure-classification	deprecatedFrom=1.0.0		"Seizure-classification and (deprecatedFrom value ""1.0.0"")"
	Myoclonic-motor-onset-seizure	4	Motor-onset-seizure	deprecatedFrom=1.0.0		"Motor-onset-seizure and (deprecatedFrom value ""1.0.0"")"
	Negative-myoclonic-motor-onset-seizure	4	Motor-onset-seizure	deprecatedFrom=1.0.0		"Motor-onset-seizure and (deprecatedFrom value ""1.0.0"")"
	Clonic-motor-onset-seizure	4	Motor-onset-seizure	deprecatedFrom=1.0.0		"Motor-onset-seizure and (deprecatedFrom value ""1.0.0"")"
	Tonic-motor-onset-seizure	4	Motor-onset-seizure	deprecatedFrom=1.0.0		"Motor-onset-seizure and (deprecatedFrom value ""1.0.0"")"
	Atonic-motor-onset-seizure	4	Motor-onset-seizure	deprecatedFrom=1.0.0		"Motor-onset-seizure and (deprecatedFrom value ""1.0.0"")"
	Myoclonic-atonic-motor-onset-seizure	4	Motor-onset-seizure	deprecatedFrom=1.0.0		"Motor-onset-seizure and (deprecatedFrom value ""1.0.0"")"
	Myoclonic-tonic-clonic-motor-onset-seizure	4	Motor-onset-seizure	deprecatedFrom=1.0.0		"Motor-onset-seizure and (deprecatedFrom value ""1.0.0"")"
	Tonic-clonic-motor-onset-seizure	4	Motor-onset-seizure	deprecatedFrom=1.0.0		"Motor-onset-seizure and (deprecatedFrom value ""1.0.0"")"
	Automatism-motor-onset-seizure	4	Motor-onset-seizure	deprecatedFrom=1.0.0		"Motor-onset-seizure and (deprecatedFrom value ""1.0.0"")"
	Hyperkinetic-motor-onset-seizure	4	Motor-onset-seizure	deprecatedFrom=1.0.0		"Motor-onset-seizure and (deprecatedFrom value ""1.0.0"")"
	Nonmotor-seizure	3	Seizure-classification		Focal or generalized seizure types in which motor activity is not prominent. Definition from ILAE 2017 Classification of Seizure Types Expanded Version	
	Behavior-arrest-nonmotor-seizure	4	Nonmotor-seizure		Arrest (pause) of activities, freezing, immobilization, as in behavior arrest seizure. Definition from ILAE 2017 Classification of Seizure Types Expanded Version	
	Sensory-nonmotor-seizure	4	Nonmotor-seizure		A perceptual experience not caused by appropriate stimuli in the external world. Definition from ILAE 2017 Classification of Seizure Types Expanded Version	
	Emotional-nonmotor-seizure	4	Nonmotor-seizure		Seizures presenting with an emotion or the appearance of having an emotion as an early prominent feature, such as fear, spontaneous joy or euphoria, laughing (gelastic), or crying (dacrystic). Definition from ILAE 2017 Classification of Seizure Types Expanded Version	
	Cognitive-nonmotor-seizure	4	Nonmotor-seizure		Pertaining to thinking and higher cortical functions, such as language, spatial perception, memory, and praxis. The previous term for similar usage as a seizure type was psychic. Definition from ILAE 2017 Classification of Seizure Types Expanded Version	
	Autonomic-nonmotor-seizure	4	Nonmotor-seizure		A distinct alteration of autonomic nervous system function involving cardiovascular, pupillary, gastrointestinal, sudomotor, vasomotor, and thermoregulatory functions. Definition from ILAE 2017 Classification of Seizure Types Expanded Version	
	Absence-seizure	3	Seizure-classification		Absence seizures present with a sudden cessation of activity and awareness. Absence seizures tend to occur in younger age groups, have more sudden start and termination, and they usually display less complex automatisms than do focal seizures with impaired awareness, but the distinctions are not absolute. EEG information may be required for accurate classification. Definition from ILAE 2017 Classification of Seizure Types Expanded Version	
	Typical-absence-seizure	4	Absence-seizure		A sudden onset, interruption of ongoing activities, a blank stare, possibly a brief upward deviation of the eyes. Usually the patient will be unresponsive when spoken to. Duration is a few seconds to half a minute with very rapid recovery. Although not always available, an EEG would show generalized epileptiform discharges during the event. An absence seizure is by definition a seizure of generalized onset. The word is not synonymous with a blank stare, which also can be encountered with focal onset seizures. Definition from ILAE 2017 Classification of Seizure Types Expanded Version	
	Atypical-absence-seizure	4	Absence-seizure		An absence seizure with changes in tone that are more pronounced than in typical absence or the onset and/or cessation is not abrupt, often associated with slow, irregular, generalized spike-wave activity. Definition from ILAE 2017 Classification of Seizure Types Expanded Version	
	Myoclonic-absence-seizure	4	Absence-seizure		A myoclonic absence seizure refers to an absence seizure with rhythmic three-per-second myoclonic movements, causing ratcheting abduction of the upper limbs leading to progressive arm elevation, and associated with three-per-second generalized spike-wave discharges. Duration is typically 10 to 60 s. Impairment of consciousness may not be obvious. Definition from ILAE 2017 Classification of Seizure Types Expanded Version	
	Eyelid-myoclonia-absence-seizure	4	Absence-seizure		Eyelid myoclonia are myoclonic jerks of the eyelids and upward deviation of the eyes, often precipitated by closing the eyes or by light. Eyelid myoclonia can be associated with absences, but also can be motor seizures without a corresponding absence, making them difficult to categorize. The 2017 classification groups them with nonmotor (absence) seizures, which may seem counterintuitive, but the myoclonia in this instance is meant to link with absence, rather than with nonmotor. Definition from ILAE 2017 Classification of Seizure Types Expanded Version	
	Episode-phase	2	Episode-property	suggestedTag=Seizure-semiology-manifestation, suggestedTag=Postictal-semiology-manifestation, suggestedTag=Ictal-EEG-patterns	The electroclinical findings (i.e., the seizure semiology and the ictal EEG) are divided in three phases: initial, subsequent and postictal.	"Episode-property and (suggestedTag value ""Seizure-semiology-manifestation"") and (suggestedTag value ""Postictal-semiology-manifestation"") and (suggestedTag value ""Ictal-EEG-patterns"")"
	Episode-phase-initial	3	Episode-phase			
	Episode-phase-subsequent	3	Episode-phase			
	Episode-phase-postictal	3	Episode-phase			
	Seizure-semiology-manifestation	2	Episode-property		Seizure semiology refers to the clinical features or signs that are observed during a seizure, such as the type of movements or behaviors exhibited by the person having the seizure, the duration of the seizure, the level of consciousness, and any associated symptoms such as aura or postictal confusion. In other words, seizure semiology describes the physical manifestations of a seizure. Semiology is described according to the ILAE Glossary of Descriptive Terminology for Ictal Semiology (Blume et al., 2001). Besides the name, the semiologic finding can also be characterized by the somatotopic modifier, laterality, body part and centricity. Uses Location-property tags.	
	Semiology-motor-manifestation	3	Seizure-semiology-manifestation		Involves musculature in any form. The motor event could consist of an increase (positive) or decrease (negative) in muscle contraction to produce a movement.	
	Semiology-elementary-motor	4	Semiology-motor-manifestation		A single type of contraction of a muscle or group of muscles that is usually stereotyped and not decomposable into phases. However, see tonic-clonic, an elementary motor sequence.	
	Semiology-motor-tonic	5	Semiology-elementary-motor	suggestedTag=Brain-laterality, suggestedTag=Body-part-location, suggestedTag=Brain-centricity, suggestedTag=Episode-event-count	A sustained increase in muscle contraction lasting a few seconds to minutes.	"Semiology-elementary-motor and (suggestedTag value ""Brain-laterality"") and (suggestedTag value ""Body-part-location"") and (suggestedTag value ""Brain-centricity"") and (suggestedTag value ""Episode-event-count"")"
	Semiology-motor-dystonic	5	Semiology-elementary-motor	suggestedTag=Brain-laterality, suggestedTag=Body-part-location, suggestedTag=Brain-centricity, suggestedTag=Episode-event-count	Sustained contractions of both agonist and antagonist muscles producing athetoid or twisting movements, which, when prolonged, may produce abnormal postures.	"Semiology-elementary-motor and (suggestedTag value ""Brain-laterality"") and (suggestedTag value ""Body-part-location"") and (suggestedTag value ""Brain-centricity"") and (suggestedTag value ""Episode-event-count"")"
	Semiology-motor-epileptic-spasm	5	Semiology-elementary-motor	suggestedTag=Brain-laterality, suggestedTag=Body-part-location, suggestedTag=Brain-centricity, suggestedTag=Episode-event-count	A sudden flexion, extension, or mixed extension flexion of predominantly proximal and truncal muscles that is usually more sustained than a myoclonic movement but not so sustained as a tonic seizure (i.e., about 1 s). Limited forms may occur: grimacing, head nodding. Frequent occurrence in clusters.	"Semiology-elementary-motor and (suggestedTag value ""Brain-laterality"") and (suggestedTag value ""Body-part-location"") and (suggestedTag value ""Brain-centricity"") and (suggestedTag value ""Episode-event-count"")"
	Semiology-motor-postural	5	Semiology-elementary-motor	suggestedTag=Brain-laterality, suggestedTag=Body-part-location, suggestedTag=Brain-centricity, suggestedTag=Episode-event-count	Adoption of a posture that may be bilaterally symmetric or asymmetric (as in a fencing posture).	"Semiology-elementary-motor and (suggestedTag value ""Brain-laterality"") and (suggestedTag value ""Body-part-location"") and (suggestedTag value ""Brain-centricity"") and (suggestedTag value ""Episode-event-count"")"
	Semiology-motor-versive	5	Semiology-elementary-motor	suggestedTag=Body-part-location, suggestedTag=Episode-event-count	A sustained, forced conjugate ocular, cephalic, and/or truncal rotation or lateral deviation from the midline.	"Semiology-elementary-motor and (suggestedTag value ""Body-part-location"") and (suggestedTag value ""Episode-event-count"")"
	Semiology-motor-clonic	5	Semiology-elementary-motor	suggestedTag=Brain-laterality, suggestedTag=Body-part-location, suggestedTag=Brain-centricity, suggestedTag=Episode-event-count	Myoclonus that is regularly repetitive, involves the same muscle groups, at a frequency of about 2 to 3 c/s, and is prolonged. Synonym: rhythmic myoclonus .	"Semiology-elementary-motor and (suggestedTag value ""Brain-laterality"") and (suggestedTag value ""Body-part-location"") and (suggestedTag value ""Brain-centricity"") and (suggestedTag value ""Episode-event-count"")"
	Semiology-motor-myoclonic	5	Semiology-elementary-motor	suggestedTag=Brain-laterality, suggestedTag=Body-part-location, suggestedTag=Brain-centricity, suggestedTag=Episode-event-count	Characterized by myoclonus. MYOCLONUS : sudden, brief (lower than 100 ms) involuntary single or multiple contraction(s) of muscles(s) or muscle groups of variable topography (axial, proximal limb, distal).	"Semiology-elementary-motor and (suggestedTag value ""Brain-laterality"") and (suggestedTag value ""Body-part-location"") and (suggestedTag value ""Brain-centricity"") and (suggestedTag value ""Episode-event-count"")"
	Semiology-motor-jacksonian-march	5	Semiology-elementary-motor	suggestedTag=Brain-laterality, suggestedTag=Body-part-location, suggestedTag=Brain-centricity, suggestedTag=Episode-event-count	Term indicating spread of clonic movements through contiguous body parts unilaterally.	"Semiology-elementary-motor and (suggestedTag value ""Brain-laterality"") and (suggestedTag value ""Body-part-location"") and (suggestedTag value ""Brain-centricity"") and (suggestedTag value ""Episode-event-count"")"
	Semiology-motor-negative-myoclonus	5	Semiology-elementary-motor	suggestedTag=Brain-laterality, suggestedTag=Body-part-location, suggestedTag=Brain-centricity, suggestedTag=Episode-event-count	Characterized by negative myoclonus. NEGATIVE MYOCLONUS: interruption of tonic muscular activity for lower than 500 ms without evidence of preceding myoclonia.	"Semiology-elementary-motor and (suggestedTag value ""Brain-laterality"") and (suggestedTag value ""Body-part-location"") and (suggestedTag value ""Brain-centricity"") and (suggestedTag value ""Episode-event-count"")"
	Semiology-motor-tonic-clonic	5	Semiology-elementary-motor	suggestedTag=Brain-laterality, suggestedTag=Body-part-location, suggestedTag=Brain-centricity, suggestedTag=Episode-event-count	A sequence consisting of a tonic followed by a clonic phase. Variants such as clonic-tonic-clonic may be seen. Asymmetry of limb posture during the tonic phase of a GTC: one arm is rigidly extended at the elbow (often with the fist clenched tightly and flexed at the wrist), whereas the opposite arm is flexed at the elbow.	"Semiology-elementary-motor and (suggestedTag value ""Brain-laterality"") and (suggestedTag value ""Body-part-location"") and (suggestedTag value ""Brain-centricity"") and (suggestedTag value ""Episode-event-count"")"
	Semiology-motor-tonic-clonic-without-figure-of-four	6	Semiology-motor-tonic-clonic			
	Semiology-motor-tonic-clonic-with-figure-of-four-extension-left-elbow	6	Semiology-motor-tonic-clonic			
	Semiology-motor-tonic-clonic-with-figure-of-four-extension-right-elbow	6	Semiology-motor-tonic-clonic			
